,text_jw
0,"ang wus kasumurupan, karajane bangsa Indhu ana ing Tanah Jawa, kang dhisik dhewe, diarani karajan ""Tarumanagara"" (Tarum = tom. kaline jeneng Citarum). Karajan iku mau dhek abad kaping 4 lan 5 wis ana, dene titi mangsaning adege ora kawruhan. Ratu ratune darah Purnawarman. Mirit saka gambar gambar kembang tunjung kang ana ing watu watu patilasan, darah Purnawarman iku padha nganggo agama Wisnu. Ing tahun 414 ana Cina aran Fa Hien, mulih saka enggone sujarah menyang patilasane Resi Budha, ing tanah Indhu Ngarep mampir ing Tanah Jawa nganti 5 sasi. Ing cathetane ana kang nerangake mangkene : 1. Ing kono akeh wong ora duwe agama (wong Sundha), sarta ora ana kang tunggal agama karo dhewekne: Budha. 2. Bangsa Cina ora ana, awit ora kasebut ing cathetane. 3. Barengane nunggang prahu saka Indhu wong 200, ana sing dedagangan, ana kang mung lelungan, karepe arep padha menyang Canton."
1,"Yen mangkono dadi dalane dedagangan saka tanah Indhu Ngarep menyang tanah Cina pancen ngliwati Tanah Jawa. Ing Tahun 435 malah wis ana utusane Ratu Jawa Kulon menyang tanah Cina, ngaturake pisungsung menyang Maharaja ing tanah Cina, minangka tandhaning tetepungan sarta murih gampang lakuning dedagangan. Karajan Tarumanagara mau ora kasumurupan pirang tahun suwene lan kepriye rusake. Wong Indhu ana ing kono ora ngowahake adat lan panguripane wong bumi, awit pancen ora gelem mulangi apa apa, lan wong bumi uga durung duwe akal niru kapinterane wong Indhu. Ewa dene meksa ana kaundhakaning kawruhe, yaiku mbatik lan nyoga jarit."
2,"Mirit saka: 1. Cathetane bangsa Cina 2. Unining tulisan tulisan kang ana ing watu watu lan candhi 3. Cathetane sawijining wong Arab, wis bisa kasumurupan sathithik sathithik mungguh kaananing wong Indhu ana ing Tanah Jawa Tengah dhek jaman samono. alika wiwitane abad kang kanem ana wong Indhu anyar teka ing Tanah Jawa Kulon. Ana ing kono padha kena ing lelara, mulane banjur padha nglereg mangetan, menyang Tanah Jawa Tengah. Wong Jawa wektu samono, isih kari banget kapinterane, yen ditandhing karo wong Indhu kang lagi neneka mau; mulane banjur dadi sor- sorane. Wong Indhu banjur ngadegake karajan ing Jepara."
3,"Omah omah padunungane wong Jawa, ya wis memper karo omah omahe wong jaman saiki, apayon atep utawa eduk lan wis nganggo kepang. Enggone dedagangan lelawanan karo wong Cina; barang dedagangane kayata: emas, salaka, gading lan liya liyane. Cina cina ngarani nagara iku Kalinga, besuke, ya diarani: Jawa. Karajan mau saya suwe saya gedhe, malah nganti mbawahake karajan cilik cilik 28 (wolu likur). Wong Cina uga nyebutake asmane sawijining ratu putri: Sima; dikandakake becik banget enggone nyekel pangrehing praja (tahun 674). Tulisaning watu kang ana cirine tahun 732, dadi kang tuwa dhewe, katemu ana sacedhake Magelang, nyebutake, manawa ana ratu kang jumeneng, jejuluk Prabu Sannaha, karajane gedhe, kang klebu jajahane yaiku tanah tanah Kedhu, Ngayogyakarta, Surakarta lan bokmenawa Tanah Jawa Wetan uga klebu dadi wewengkone karajan iku. Mirit caritane, karajan kang kasebut iku tata tentrem banget kaya kang kasebut ing tulisan kang katemu ana ing patilasan: Nadyan wong wong padha turu ana ing dalan dalan, ora sumelang, yen ana begal utawa bebaya liyane. Mirit kandhane sawijining wong Arab, dhek tengah tengahane abad kang kaping sanga, ratu ing Tanah Jawa wis mbawahake tanah Kedah ing Malaka (pamelikan timah). Karajan ing dhuwur iki sakawit ora kawruhan jenenge, nanging banjur ana karangan kang katulis ing watu kang titi mangsane tahun 919, nyebutake karajan Jawa ing Mataram. Jembar jajahane, mungguha saiki tekan Kedhu, Ngayogyakarta, Surakarta; manglore tekan sagara; mangetane tekan tanah tanah ing Tanah Jawa Wetan sawatara. Kuthane karan : Mendhangkamulan. Wong Arab ngandhakake, ana ratu Jawa mbedhah karajan Khamer (Indhu Buri). Sing kasebut iki ayake iya karajan Mataram mau. Kajaba Khamer, karajan Jawa iya wis mbawahake pulo pulo akeh. Pulo pulo iku mawa gunung geni. Karajan Jawa mau sugih emas lan bumbu craken. Wong Arab iya akeh kang lelawanan dedagangan. Sabakdane tahun 928 ora ana katrangan apa apa ing bab kaanane karajan Mataram."
4,"Kang kacarita banjur ing Tanah Jawa Wetan. Ayake bae karajan Mataram mau rusak dening panjebluge gunung Merapi (Merbabu), dene wonge kang akeh padha ngungsi mangetan. Ing abad 17 karajan Mataram banjur madeg maneh, gedhe lan panguwasane irib iriban karo karajan Mataram kuna. Agamane wong Indhu sing padha ngejawa rupa rupa. Ana ing tanah wutah getihe dhewe ing kunane wong Indhu ngedhep marang Brahma, Wisnu lan Syiwah, iya iku kang kaaranan Trimurti. Kejaba saka iku uga nembah marang dewa akeh liya liyane, kayata: Ganesya, putrane Bethari Durga. Manut piwulange agama Indhu pamerange manungsa dadi patang golongan, yaiku: - para Brahmana (bangsa pandhita) - para Satriya (bangsa luhur) - para Wesya (bangsa kriya) - para Syudra (bangsa wong cilik) Piwulange agama lan padatane wong Indhu kaemot ing layang kang misuwur, jenenge Wedha. Kira kira 500 tahun sadurunge wiwitane tahun Kristen, ing tanah Indhu ana sawijining darah luhur peparab Syakya Muni, Gautama utawa Budha. Mungguh piwulange geseh banget karo agamane wong Indhu mau. Resi Budha ninggal marang kadonyan, asesirik lan mulang muruk marang wong. Kajaba ora nembah dewa dewa, piwulange: sarehne wong iku mungguhing kamanungsane padha bae, dadine ora kena diperang patang golongan. Para Brahmana Indhu mesthi bae ora seneng pikire, mulane kerep ana pasulayan gedhe. Ana ing tanah Indhu wong Budha mau banjur peperangan karo wong agama Indhu. Wusana bangsa Budha kalah lan banjur ngili menyang Ceylon sisih kidul, Indu Buri, Thibet, Cina, Jepang. Mungguh wong agama Indhu iku pangedepe ora padha. Ana sing banget olehe memundhi marang Syiwah yaiku para Syiwaiet (ing Tanah Jawa Tengah); ana sing banget pangedepe marang Wisynu, yaiku para Wisynuiet (ing Tanah Jawa Kulon). Kajaba saka iku uga akeh wong agama Budha, nanging ana ing Tanah Jawa agama agama iku bisa rukun, malah sok dicampur bae."
5,"Petilasane agama Indhu mau saikine akeh banget, kayata: Candhi candhi ing plato Dieng (Syiwah), iku bokmenawa yasane ratu darah Sanjaya. Candhi ing Kalasan ana titi mangsane tahun 778, ayake iki candhi tuwa dhewe (Budha), yasane ratu darah Syailendra. Candhi Budha kang misuwur dhewe, yaiku Barabudhur lan Mendut. Candhi Prambanan (Syiwah). Ing sacedhake Prambanan ana candhi campuran Budha lan Syiwah."
6,"ng dhuwur wus kasebutake yen Tanah Jawa Wetan, kabawah karajan Indhu ing Mataram; nanging wong Indhu kang manggon ana ing Tanah Jawa Wetan ora pati akeh, yen katimbang karo kang manggon ing Tanah Jawa Tengah (Kedhu). Marga saka iku wong Indhu kudu kumpul karo wong bumi, prasasat tunggal dadi sabangsa. Ing wiwitane abad 10 ana pepatihing karajan Tanah Jawa Tengah aran Empu Sindhok lolos mangetan. Let sawatara tahun empu Sindhok mau jumeneng ratu ing Tanah Jawa Wetan, karajane ing Kauripan (Paresidhenan Surabaya sisih kidul). Ambawahake: Surabaya, Pasuruwan, Kedhiri, Bali bok manawa iya kabawah. Enggone jumeneng ratu tekan tahun 944 lan iya jejuluk Nata ing Mataram. Nata ing Mataram mau banget pangedepe marang agama Budha. Empu Sindhok misuwur wasis enggone ngereh praja. Ana cathetan kang muni mangkene: ""Awit saka suwening enggone jumeneng ratu, marcapada katon tentrem; wulu wetuning bumi nganti turah turah ora karuhan kehe. "" Ing tahun 1010 Erlangga tetep jumeneng ratu, banjur nerusake enggone mangun paprangan lan ngelar jajahan. Ing tahun 1037 enggone paprangan wis rampung, negara reja, para kawula padha tentrem. Dene karatone iya ana ing Kauripan. Sang Prabu Erlangga ora kesupen marang kabecikaning para pandhita lan para tapa, kang gedhe pitulungane nalika panjenengane lagi kasrakat."
7,"Minangka pamalesing kabecikane para pandhita, Sang Nata yasa pasraman apik banget, dumunung ing sikile gunung Penanggungan. Pasraman mau kinubeng ing patamanan kang luwih dening asri, lan rerenggane sarwa peni sarta endah. Saka edine, nganti misuwur ing manca praja, saben dina aselur wong kang padha sujarah mrono. Pangadilane Sang Nata jejeg. Wong desa kang nrajang angger angger nagara padha kapatrapan paukuman utawa didhendha. Kecu, maling, sapanunggalane kapatrapan ukum pati. Sang Prabu enggone nindakake paprentahan dibantu ing priyagung 4, padha oleh asil saka pametuning lemah lenggahe. Saka enggone manggalih marang tetanen yaiku pagaweyaning kawula kang akeh, Sang Nata yasa bendungan gedhe ana ing kali Brantas. Sang Nata uga menggalih banget marang panggaotan lan dedagangan. Kutha Tuban nalika samono panggonan sudagar, oleh biyantu akeh banget saka Sang Prabu murih majuning dedagangan lan lelayaran. Sang Nata yen sinewaka lenggah dhampar (palenggahan cendhek pesagi), ngagem agem ageman sarwa sutra, remane diukel lan ngagem cenela. Yen miyos nitih dwipangga utawa rata, diarak prajurit 700. Punggawa lan kawula kang kapethuk tindake Sang Nata banjur padha sumungkem ing lemah (ndhodhok ngapurancang?). Para kawula padha ngore rambut, enggone bebedan tekan ing wates dhadha. Omahe kalebu asri, nganggo payon gendheng kuning utawa abang. Wong lara padha ora tetamba mung nyuwun pitulunganing para dewa bae, utawa marang Budha. Wong wong padha seneng praon lan lelungan turut gunung, akeh kang nunggang tandhu utawa joli. Dhek samono wong wong iya wis padha bisa njoget, gamelane suling, kendhang lan gambang. Karsane Sang Prabu besuk ing sapengkere kang gumanti jumeneng Nata putrane loro pisan, mulane kratone banjur diparo: Jenggala (sabageyaning: Surabaya sarta Pasuruwan) lan Kedhiri."
8,"Dene kang minangka watese: pager tembok kang sinebut ""Pinggir Raksa"", wiwit saka puncaking Gunung Kawi, mangisor, nurut kali Leksa banjur urut ing branglore kali Brantas saka wetan mangulon tekan ing desa kang saiki aran ""Juga"", nuli munggah mangidul, teruse kira kira nganti tumeka ing pasisir. Gugur gugurane tembok iku saiki isih ana tilase, kayata ing sacedhaking kali Leksa, sakulon lan sakiduling kali Brantas, ing watesing afd. Malang lan Blitar. Mungguhing babad Jawa jumenenge Prabu Erlangga kaanggep minangka pepadhang sajroning pepeteng, awit rada akeh caritane kang kasumurupan. Kawruh kasusastran wis dhuwur. Layang layange ing jaman iku tekane ing jaman saiki isih misuwur becik lan dadi teturutaning crita crita wayang. Layang layang mau basane diarani: Jawa Kuna, kayata: 1. Layang Mahabarata 2. Layang Ramayana lan Arjuna Wiwaha. Karajan Jenggala ora lestari gedhe, awit pecah pecah dadi karajan cilik cilik, marga saka diwaris marang putraning Nata; yaiku praja Jenggala (Jenggala anyar); Tumapel utawa Singasari lan Urawan. Karajan cilik cilik kang cedhak wates Kedhiri or suwe banjur ngumpul melu Kedhiri, liyane isih terus madeg dhewe nganti tekan abad 13. Kerajan Kedhiri (Daha, Panjalu) mungguha saiki mbawahake paresidhenan Kedhiri, saperangane Pasuruwan lan Madiyun. Kuthane ana ing kutha Kedhiri saiki. Karajan mau bisa dadi kuncara. Ing wektu iku kasusastran Jawa dhuwur banget, nalika jamane Jayabaya (abad 12) ngluwihi kang uwis uwis lan tumekane jaman saiki isih sinebut luhur, durung ana kang madhani. Ing tahun 1104 ing kedhaton ana pujangga jenenge: Triguna utawa Managocna. Pujangga iku sing nganggit layang Sumanasantaka lan Kresnayana. Raden putra utawa Panji kang kacarita ing dongeng kae, bokmenawa iya ratu ing Daha, kang jejuluk Prabu Kamesywara I. Jumeneng ana wiwitane abad kang kaping 12. Garwane kekasih ratu Kirana (Candra Kirana) putrane ratu Jenggala. Ing mangsa iki ana pujangga jenenge Empu Dharmaja nganggit layang Smaradhana."
9,"Raden Panji nganti saiki tansah kacarita ana lakone wayang gedhog lan wayang topeng. Pujanggane Jayabaya aran Empu Sedah lan Empu Panuluh. Empu Sedah ing tahun Saka 1079 (= 1157) methik saperanganing layang Mahabarata, dianggit lan didhapur cara Jawa, dijenengake layang Bharata Yudha. Wong Jawa ing wektu iku wis pinter, wong Indhu kesilep, karajan Indhu wis dadi karajan Jawa."
10,"ng tahun 1222 ana ratu ing Tumapel utawa Singasari, jenenge Ken Angrok. Critane Ken Angrok iki saka layang Pararaton. Ketemune layang iki ana ing Bali dhek tahun 1891. Ken Angrok lair ana ing sacedhake Tumapel (Singasari), asal wong tani lumrah bae. Ken Angrok kacarita bagus rupane lan bisa nenarik katresnaning wong, nanging banget kareme marang pangaji aji lan wani marang penggawe luput."
11,"Ing sawijining dina ana Brahmana ketemu karo dhewekne, kandha yen dhewekne titising Wisnu. Anggone kandha mangkono iku, awit Brahmana mau ngerti yen Ken Angrok iku wong kang gedhe karepe lan kenceng budine. Brahmana banjur golek dalan bisane Ken Angrok kacedhak karo adipati ing kono, Sang Tunggul Ametung. Ora antara suwe kelakon Ken Angrok kaabdekake. Bareng wis mangkono, Ken Angrok banjur tansah golek dalan kapriye enggone bisa ngendhih Sang Adipati, nggenteni jumeneng. Ketemuning nalar Ken Angrok banjur ndandakake keris becik marang Empu Gandring. Sawise keris dadi, katon becik temenan, nganti mitrane Ken Angrok aran Keboijo kepencut kepengin nganggo, banjur nembung nyilih: oleh. Saka senenge, keris mau saben dina dianggo sarta dipamer pamerake, dikandhakake duweke dhewe. Bareng wis sawatara dina Ken Angrok banjur nyolong kerise dhewe kang lagi disilih ing mitrane mau dianggo nyidra Sang Adipati. Kelakon seda, keris ditinggal ing sandhinge layon. Urusaning prakara: mitrane Ken Angrok sing kena ing dakwa, diputus ukum pati. Ken Angrok banjur bisa oleh Sang putri randaning Tunggul Ametung lan gumanti madeg adipati: Sang Putri asmane Ken Dhedhes. Sasuwene dicekel Ken Angrok negarane tata, reja, wong cilik banget sungkeme. Sawise mbedhah karajan cilik cilik ing Jenggala, Ken Angrok banjur emoh kebawah Kedhiri, malah ing tahun 1222 mbedhah praja Kedhiri nganti kelakon menang, Ratu ing Kedhiri Prabu Kertajaya seda nggantung sabalane kang padha tuhu. Kedhiri banjur ditanduri adipati kabawah Singasari. Bareng para ratu darah Empu Sindhok wis kalah kabeh karo Ken Angrok, Ken Angrok banjur jumeneng Ratu gedhe, jejuluk Prabu Rejasa, yaiku kang nurunake para ratu ing Majapait. Kacarita Sang Retna Dhedhes nalika sedane adipati Tunggul Ametung wis ambobot. Bareng wis tekan mangsane, Sang Retna mbabar putra kakung, diparingi peparab Raden Anusapati."
12,"Wiwit timur nganti diwasa Sang Pangeran ora ngerti yen satemene dudu putrane Prabu Rejasa, nanging rumangsa yen ora ditresnani ing Sang Prabu, beda banget karo rayi rayine. Ing sawijining dina Anusapati kelair marang ibune mangkene: ""Ibu, punapa, dene Kangjeng rama punika teka boten remen dhateng kula?"" Sang Retna banget trenyuhing galih mireng atur sasambate kang putra, wasana banjur keprojol pangandikane; kang putra dicritani lelakone wiwitan tekan wekasan. Anusapati banget ing pangungune, sanalika banjur duwe sedya males ukum, nanging isih sinamun ing semu. Keris yasane Empu Gandring disuwun, pawatane mung kepingin banget anganggo. Kang ibu lamba ing galih, keris diparingake. Anusapati banjur nimbali abdine kekasih, diparingi keris mau lan diweruhake ing wewadine. Bengine Sang Prabu seda kaprajaya ing duratmaka. Layone Sang Prabu dicandhi ana ing Kagenengan (cedhak Malang). Anusapati nggenteni jumeneng Nata. Anusapati jumeneng ora suwe, awit Raden Tohjaya ngerti yen Anusapati kang nyedani ramane, mulane sumedya males ukum lan iya kelakon. Tohjaya jumeneng Nata, nanging iya ora suwe. Tohjaya utusan mantrine aran Lembu Ampal, didhawuhi nyirnakake kalilipe loro, yaiku: Ranggawuni, putrane Anusapati, lan nakdulure kang aran Narasingamurti; yen ora bisa kelakon, Lembu Ampal dhewe bakal kena ukum pati. Dumadakan ana sawijining Brahmana kang welas marang raden loro, banjur wewarah saperlune. Satriya loro banjur ndhelik ana ing panggonane Panji Patipati. Lembu Ampal nggoleki raden loro ora ketemu, banjur ora wani mulih, ngungsi marang Panji Patipati. Bareng ana ing kono mbalik ngiloni raden loro, malah ngrembugi para punggawa kang ora cocog karo Tohjaya diajak ngraman, wasana kelakon, Sang Prabu nganti nemahi seda. Ranggawuni jumeneng Nata ajejuluk Syri Wisynuwardhana nganti nakdhereke Narasinga. Nganti tekan ing seda priyagung loro mau rukun banget, nganti dibasakake: ""Kaya Wisynu lan kang raka Bathara Endra"". Karatone mundhak gedhe pulih kaya dhek jamane Prabu Erlangga, malah jajahane wuwuh Madura."
13,"Sang Nata seda ing tahun 1268, layone diobong kaya adat, awune sing separo dicandhi ana ing Weleri, ditumpangi reca Syiwah, sing separo dipethak ana candhi Jago (Tumpang) nganggo reca Budha. Dadi tetela ing wektu iku agama Syiwah karo Budha campur."
14,"atu Singasari kang Kaping V, jumeneng mekasi. Sasedane Syri Wisynuwardhana pangeran pati jumeneng Nata, ajejuluk Prabu Kartanagara. Sang Prabu manggalih marang kawruh kagunan, lan kasusastran, lan iya manggalih marang undhaking jajahan, nanging kurang ngatos atos, lan kersa ngunjuk nganti dadi wuru. Ana nayakaning praja aran Banyak Widhe utama Arya Wiraraja, tepung becik lan Jayakatwang, adipati ing Daha. Satriya iku ora sungkem marang ratune, malah wis sekuthon karo Jayakatwang, arep mbalela. Dumadakan ana punggawa kang matur prakara iku, nanging Sang Prabu ora menggalih, Wiraraja malah diangkat dadi adipati ana ing Madura. Pepatihe Sang Nata aran Raganatha rumeksa banget marang ratune, nganti sok wani ngaturi penget marang Sang Prabu ing bab kang ora bener, nanging Sang Prabu ora rena ing galih, ora nimbangi rumeksaning patih setya iku, malah banjur milih patih liya kang bisa ngladeni karsane. Patih wredha diundur, winisuda dadi: nayaka pradata, dadi wis ora campur karo prakara pangreh praja. Patih anyar senenge mung ngalem marang ratune lan ngladosi unjuk unjukan. Ana utusan saka ratu agung ing nagara Cina (Chubilai) dhawuh supaya Prabu Kartanagara nyalirani dhewe utawa wakilsuwana marang nagara Cina perlu caos bekti (tahun 1289). Sang Prabu duka banget. Bathuking Cina utusan digambari pasemon kang ora apik, nelakake dukane Sang Prabu. Bareng tekan ing nagara Cina patrape ratu Jawa kang mangkono iku mau njalari dukane ratu binathara ing Cina,."
15,"Ing tahun1292 ana prajurit gedhe saka ing Cina arep ngukum ing kuwanene wong Jawa. Wiraraja sasuwene ana ing Madura isih ngrungok ngrungokake apa kang kalakon ana ing Singasari, lan iya weruh uga yen ing wektu iku prajurit Singasari dilurugake menyang Sumatra. Wiraraja ngajani Jayakatwang akon nangguh mbedhah Singasari, mumpung nagara lagi kesisan bala. Jayakatwang ngleksanani, lan Singasari kelakon bedhah. Ratu lan patihe katungkep ing mungsuh isih terus unjuk unjukan bae (wuru), mulane ora rekasa pinurih sedane. Raden Wijaya, wayahe Narasinga, nuli umangsah ngetog kaprawiran mbelani nagara lan ratune, nanging wis kaslepek karoban wong Daha, mulane banjur kepeksa ngoncati, mung kari nggawa bala 12, genti genti nggendhong Sang Putri garwane Raden Wijaya, putrane Prabu Kartanagara. Lampahe Raden Wijaya sasentanane nusup angayam alas. Kalebu wilangan 12 iku ana satriyane loro, putrane Wiraraja, duwe atur marang Gustine supaya ngungsi menyang Madura. Sang Pangeran maune ora karsa, nanging suwe suwe nuruti. Ana ing Madura ditampani kalawan becik. Rembuge Wiraraja, Raden Wijaya diaturi suwita menyang Daha. Wiraraja sing arep nglantarake. Yen wis kelakon suwita Raden Wijaya diaturi nyetitekake para punggawa ing Daha, sapa sing kendel utawa jirih, tuhu utawa lamis. Yen wis antara suwe diaturi nyuwun tanah tanah Trik, dibabada banjur dienggonana. Raden Wijaya nurut ing pitudhuh, lan iya kelakon suwita ing Daha. Kacarita pasuwitane kanggep banget, amarga saka pintere nuju karsa, lan saka pintere olah gegaman; wong sa Daha ora ana sing bisa ngalahake. Kabeh piwulange Wiraraja ditindakake, dilalah Sang Prabu teka dhangan bae, malah bareng tanah Trik wis dibabad, Raden Wijaya nyuwun manggon ing kono iya dililani. Kacarita nalika babade tanah Trik mau, ana wong kang methik woh maja dipangan, nanging rasane pait. Awit saka iku desa ingkono mau banjur dijenengake Majapait."
16,"Bareng Raden Wijaya wis manggon ing Majapait, rumangsa wis wayahe tata tata males ukum, ngrusak kraton Daha, ananging Wiraraja akon sabar dhisik, awit isih ngenteni prajurit saka nagara Cina kang arep ngukum wong Singasari. Karepe Wiraraja arep ngrewangi Cina bae dhisik, besuke arep mbalik mungsuh Cina. Wiraraja banjur boyong sakulawargane lan saprajurite menyang Majapait ngumpul dadi siji karo Raden Wijaya."
17,"ng Bab 5 ana critane Prabu Kartanagara enggone anjangka undhaking jajahane. Ana ing tanah Sumatra kelakon bisa oleh jajahan. Ing ngisor iki crita sathithik tumraping karajan karajan ing tanah Melayu. Kacarita ratu ing Funan, kira kira ing sajroning abad 3 ngelar jajahan, ngelun tanah Sumatra, Jawa lan liya liyane, ayake ratu iku kang yasa reca reca ing tanah Pasemah. Ing abad kapitu ana golonganing para pangeran saka ing Indhu Buri, padha manggon ing sakiwa tengening Palembang, banjur ngedegake nagara gedhe, jenenge karajan crivijaya (= Syriwijaya, sinebut ing bangsa Cina nagara: Sambotsai)."
18,"Ratu ratune padha darah Warman, isih dumunung sanak karo darah Purnawarman ing Tanah Jawa dhek abad 4 - 5, apadene darah Mulawarman ing Kutai lan Borneo dhek watara tahun 400. Nagara crivijaya jajahane kira kira Sumatra sisih kidul lan tengah, Malaka, Kamboja lan malah tekan Tanah Jawa. Ing tahun 686 ratu agung ing negara crivijaya nglurugi Tanah Jawa, awit Tanah Jawa ora tuhu pangedhepe marang crivijaya. Sajroning abad 10 prajurit Jawa genti nglurugi crivijaya, menang, nanging ora suwe crivijaya bisa kombul maneh. Praja iku ajeg enggone nglakokake utusan marang Narendra ing Cina. Ing sajroning abad 12 lan 13 nagara gedhe crivijaya pecah dadi karajan cilik cilik. Darah Warman jumeneng ana ing tanah kang sinebut tanah: ""Melayu"" yaiku saikine Jambi. Rehning pasisire tanah Melayu kono akeh rerusuh, wonge akeh kang padha ngungsi marang tanah pagunungan kang loh, ana ing kono padha dedhukuh. Bareng Tanah Jawa gedhe panguwasane, Prabu Kartanagara (1268 - 1292) kalakon bisa ngrusak kutha Pasei, lan ngejegi Jambi, Palembang, Riouw sarta kutha kutha akeh ing Borneo apadene pulo pulo ing Moloko. Ing saantaraning tahun 1275 lan 1293 wong Jawa nglurugi tanah pagunungan Jambi mau yaiku tanah kang besuke aran Menangkabau. Lurugan iku diarani: Pamalayu. Ing tahun 1268 Prabu Kartanagara angganjar reca marang ratu ing Dharmmacraya (Darmasraya) uga dumunung ing tanah Jambi, ing saikine ora adoh karo Sungai Lansat. Karajan iku ing besuke kalebu jajahan Majapait, rajane darah Warman jejuluk Tribuwana (Mauliwarman) kagungan garwa bangsa Melayu, kang putrine (putrane putri) ayake dai garwane Raden Wijaya biyen. Sang Raja Tribhuwana melu karo bangsa Jawa nglurugi tanah Padhang Hulu. Miturut carita Melayu, lurugan mau ora oleh gawe, mung marga saka klebu ing gelar, kalah enggone adu kebo, mulane kuthane banjur jeneng Menangkabau iku."
19,"Ana raja wewengkone karajan Dharmmacraya jejuluk Adityawarman nagarane ing Malayupura, kang ing tahun 1347 wus merdika, ambawa pribadhi, iku nglurugi Menangkabau, nanging ora nganti dadi perang, malah banjur diangkat dadi raja ing kono, awit pancen dianggep bangsa Melayu. Jumenenge ana ing Menangkabau wiwit tahun 1347 tekan 1375, kecrita ing kawicaksanane lan pintere nyekel praja. Tumeka saprene Sang Adityawarman sarta nayakane loro kang aran Papatih Sabatang lan Kyai Katumanggungan isih dipundhi pundhi marang bangsa Menangkabau. Sapungkure Sang Aditya wis ora ana raja ing Menangkabau kang kecrita. Negarane pecah pecah, ing saiki isih akeh titike, mungguh ing kaluhuraning para raja Jawa asal Indhu, ana ing tanah Menangkabau kono, luwih luwih tumraping basa lan sastrane. Darah raja raja kuna ing Menangkabau mau enteke durung lawas, kang pungkas pungkasan putri, sedane lagi saiki bae. Ing tahun 1377 kutha Sanbotsai ing tanah Palembang rinusak ing balane Prabu Ayamwuruk. Kang kuwasa ing tanah Palembang kasebut jeneng Arya Damar nurunake Raden Patah (+/- tahun 1500). Awit saka ambruking karaton Majapait, Palembang iya katut apes, besuke kalah karo Banten. Kaluhuraning Tanah Jawa ana ing Sumatra sisih kidul kono tumekane dina iki uga iya isih akeh tilas tilase. ng tengah tengahane tahun 1292 Maharaja Choebilai sida ngangkatake wadya bala menyang ing Tanah Jawa perlu arep ngukum Prabu Kartanagara. Ana ing pacekan (Surabaya) prau Jawa kalah, nuli bala Cina arep nglurugi9 Daha, kang dikira panggonane Kartanagara (kang nalika iku wis seda). Kacarita Raden Wijaya dhek jaman samono wus wiwit mbalela marang Jayakatwang ratu ing Daha."
