,text_jw
81,"Karepe Fatimah arep makolehake kaponakane asma Sarif Abdullah, kang wus kapundhut mantu sarta kaangkat Pangeran dening Sultan Zeinul Arifin. Nadyan katemtokake sarembug lan Compagnie, yen kawenangake gumanti jumeneng ratu, putrane Kangjeng Sultan kang wus kaangkat Pangeran Gusti, ewa dene Sarifah Fatimah or gumingsir. Saka pangojok ojok lan wewadule Fatimah, Sultan ing Banten nganti kalimput, duwe panjaluk marang Van Imhoff supaya Sarif Abdullah kenaa kajumenengake Adipati Anom, dene Pangeran Gusti bakal kalorot. Bareng Pangeran Gusti krungu pawarta kang mengkono iku, enggal enggal nyuwun pangeyuban menyang Betawi. Saking pintere Fatimah lan sumelange VOC. bok menawa bakal kepeksa perangan maneh yen ora nurutana karsane Sultan Banten lan Fatimah, murih katentremaning nagara Sang Pangeran Gusti disingkirake menyang Ceylon. Let satahun Sultan Banten kaya kaya gerah engetan klenjit klenjit arep owah, Sarifah Fatimah age age njaluk lerehe marang Van Imhoff. GG. Van Imhoff mituruti, Sultan Banten malah dibuwang menyang Ambon, ora lawas seda ana ing kono, nanging Compagnie bakal ngayomi. Sakendhange Sultan ing Banten, kang ngereh negara Fatimah kabantu ing Sarif Abdullah. Sarehne pangrehe sawenang wenang, wong Banten kang dipanggedheni Ki Tapa lan Ratu Bagus, emoh diratoni ing priyagung kang dudu darah Banten, dadi ora suwe banjur ana kraman. Compagnie tetulung nguruni prajurit, nanging kalah, awit kraman pancen santosa. Nalika nedheng nedhenge geger gegeran ing Banten iku GG. Van Imhoff seda. Saka pamanggihe GG. Mossel, Sarifah Fatimah utawa Sarif Abdullah pancen ora nduweni wajib jumeneng ratu, mulane Pangeran Gusti bakal dikondurake dibiyantu VOC. bisane jumeneng Sultan. Ing tahun 1750 Fatimah lan Sarif Abdullah kecekel kabeh sarta banjur dikendhang. Pangeran Arya Adi Santika, kang rayi Sultan Zeinul Arifin katetepake dadi Sultan, ajejuluk: Abdul Maali Mohamad Wasiul Halimin, nanging nalika jumeneng iku nganggo prajangjian yen anggone jumeneng mung nggadhuh, malah tanah Lampung banjur dadi darbeking VOC."
82,"Prakara iku isih ndadekake kraman maneh: Ki Tapa lan sagolongane wong Banten, kang ora gelem rujuk lan wong Walanda, ora tarima. Pangeran Bagus Buang diangkat jumeneng ratu, merangi Arya Adi Santika, Pangeran Gusti lan VOC. , nanging suwe suwe Ki Tapa kalah. Ing tahun 1753 ing Banten wis tentrem. Pangeran Arya Adi Santika seleh keprabon marang Pangeran Gusti kang banjur ajejuluk Abu'n Natsar Mohamad Arif Zeinul Acekin. Ratu anyar iku nalika jumenenge iya nganggo nganyarake prajanji kaya dene prajanjine Sultan Adi Santika lan VOC."
83,"ng sasirepe kraman Mataram lan Banten, ing Tanah Jawa banjur dadi tentrem, kang durung mung ing Blambangan, amarga saka panggawene wong ing Bali lan turune Untung Surapati. Sarehne ing wektu iku wus ana wong Inggris kang dedagangan ing kono, VOC. sumelang yen tanah Bang Wetan bakal dirukun, mulane banjur nglurugake bala mrono. Wiwit ing tahun 1772 Blambangan iya sirep. Dadi saTanah Jawa ing jaman iku wis wiwit raharja lan kelakon kawengku ing Compagnie kabeh. VOC. wis prasasat maharaja, sakehing mungsuhe padha dipunthes, kira kira wis ora bakal mbebayani, ora abot sanggane. Nanging mungguh sranane kang kanggo munthes iku ing jaman wekas wekasan wis dudu kasentosaning wadya bala thok, nanging uga nganggo akal kajuligan, mratandhani yen VOC. entek kekuwatane, kaya kang dicritakake ing ngisor iki. Sabakdane jaman peperangan ing Tanah Jawa, saya suwe saya katon yen Compagnie bakal ambruk. GG. Mossel 9tahun 1750 - 1761) lan Van der Parra (tahun 1761 - 1775), apadene para GG. kang padha gumanti yaiku Van Riemsdijk (tahun 1775 - 1777), De Klerk (tahun 1777 - 1780) padha mbudi daya ngentekake akal, murih tuluse VOC. , nanging ngrekasane tanpa pituwas, Compagnie wis ora kena digendholi. Nalika semana ing Tanah Jawa malah wiwit raharja, awit wis ora ana peperangan, sarta Compagnie tansah njaga murih bisane tansah memitran karo Kangjeng Sunan ing Kejawan."
84,"Sanadyan tindake para ratu Jawa kerep ndadekake kapitunane wong cilik, nanging Compagnie trima meneng, awit pancen ora ngrembug marang begja cilakane wong bumi. Yen kadhang kala Surakarta lan Ngayogyakarta padha gesrek prakara watesing nagara, VOC. iya ora gelem melu melu. Jajahan ing sajabane Tanah Jawa ing wektu iku VOC. iya ora pati bisa ngrembug, wasana suda kuwasane. Ana ing Indhu Ngarep kuwasane wong Inggris saya gedhe. Malah ana ing Benggala kuwasane ngungkuli VOC. Kerep bae wong Walanda lan wong Inggris ana ing kono padha grejegan, malah terkadhang nganti dadi perang. Sarehne VOC. kalah kuwasa, wasana kantor kantore ing Benggala kudu nganggo diawat awati ing wong Inggris. Ana ing Ceylon VOC. kerep sulaya karo raja ing Kandhi prakara padagangan manis jangan lan pandumaning bebathen, nanging rahayu isih bisa terus panguwasane. Ana ing Persi VOC. ora bisa terus dedagangan. Padagangan ing Sumatra pasisir kulon lan wetan ora bisa ngolehake kauntungan kang memper marang VOC. , samono uga padagangan ing Borneo. Ana ing kapulowan MOLOKO VOC. iya isih lestari oleh dagangan craken, nanging saya katon yen suda suda. Sarehne Compagnie kaya mangkono kaanane, ora lawas mesthi bakal ambruk. Kebarengan tanah Walanda banjur perang lan Inggris, iku kang nyengkakake ambruke VOC. , awit VOC, wis ora bisa ngukuhi jajahan ing Asia, marga saka kuranging prajurit, mangka ora bisa oleh bantu saka nagara Walanda. Kantor kantor ing Indhu Ngarep tiba ing tangane wong Inggris. Jajahan ing Sumatra pasisir wetan kulon kena direbut ora nganggo bisa lawan. Kaanane VOC. ing nagara Walanda luwih rekasa lan ing tanah Indhiya. Prau prau kang saka Indhiya akeh kang padha dirampas dening wong Inggris. Saking kekesing ati nganti ora ana prau dagang kang wani mingsed saka pelabuhan. Dadi laku dagang mandeg babar pisan."
85,"ing Betawi ora ana prau teka anggawa prajurit, gegaman utawa dhuwit, utawa njupuk dagangan, nganti sakehing gudang gudang padha ambruk, mulane yen ana prau saka negara liya kang gelem kulak dagangan murah murahan bae. Parentah ing Betawi wis rumangsa bungah. Nganti telung tahun lawase tanah Indhiya enggone karibedan mangkono iku, wasana ing tahun 1784 perange Walanda leren. Miturut prajangjiane bedhami: Compagnie ora kena mbanjurake bedhami monopolie ing tanah Indhu, wong Inggris ora kena dilarangi enggone dagang layar ana ing kono. Ing sabakdane perang VOC. saya katon ngrekasane, ing tahun 1791 kecupetan 96 yuta, mangka arep golek utangan wis ora ana kang ngendel. Mangkono iku kaanane VOC. nalika nagara Walanda lagi jaman dahuru, wiwit tahun 1795 nagara Walanda banjur kecekel ing para kraman ing Frankrijk, mangka nagara Frankrijk mungsuhan karo Inggris. Awit saka iku tanah Walanda iya melu mungsuhan karo negara Inggris. Kacarita Willem V, Stadhouder ing tanah Walanda ing sajroning jaman dahuru mau sumingkir menyang tanah Inggris. Dene VOC. saka panemune Willem V luwih becik dititipna dhisik menyang wong Inggris supaya aja kecekel ing para kraman Walanda, awit yen wis kecekel ing para kraman bisa uga direbut ing krajan Inggris (Layang saka Kew. ), nanging panimbang iku ora digugu, mulane VOC. sida diperangi karajan Inggris. Wiwit tahun 1796 jajahane VOC. meh kabeh, kejaba Tanah Jawa lan Ternate, klakon direbut Inggris. Wasana ing tahun 1799 VOC. ambruk, dibubarake, barang darbeke diliyer ing Parentah Walanda kang lagi tetep anyar."
86,"ng saambruke VOC. , tanah Indhiya kacekel ing Parentah Praja Walanda (Bataafsche Republiek), nanging mungguh pranatane peprentahan wiwitane owah, sakehing punggawa dilestarekake pangkate lawas, mung bae salin bendarane, yaiku Parentah Praja Walanda. Ing jaman iku Parentah Walanda duwe karep mbeciki pangrehing tanah Indhiya; mung bae mungguh ing rekane isih rekasa, awit ing Bataafsche Republiek panemune para pinter padha geseh. Ana Sarjana loro maune padha panggedhening Compagnie, nanging karepe nglestarekake monopolie lan parokane VOC. liyane, punggawaning negara uga ngiras dadi sudagar. Sijine aran Van Hogendorp kang maune dadi Gezaghebber ing Tanah Jawa Wetan, duwe karep misahake paprentahan lan dagang, apa dene duwe karep nyuwak monopolie. Sesanggan peksan lan gugur gunung arep dimareni."
87,"Van Hogendorp uga banget nyuwun marang Parentah Walanda, supaya peprentahaning tanah Indhiya bisa becik, pangadilan bisaa sabenere, apa dene supaya wong Pribumi diparingana lemah dhewe dhewe (individueel groundbezit). Parentah Walanda banjur nganakake Commisie, kang dipatah gawe rancangan mungguh ing paprentahan tanah Indhiya. Wasana ing tahun 1805 panemune Van Hogendorp dianggep ing Parentah Walanda. Mung bae wong kang diutus supaya anindakake peprentahan mau, ora bisa tekan ing tanah Indhiya, nuli didhawuhi mulih, awit bab owahing peprentahan ing tanah Walanda. Kacarita ing tanah Walanda wiwit tahun 1806 Bataafsche Republiek salin dadi karajan, kang jumeneng rate Lodewijk Napoleon, sadhereke Keizer Napoleon ing Frankrijk. Mangka Sang Keizer banget sumelange yen tanah Indhiya bakal direbut ing karajan Inggris, mulane Lodewijk Napoleon kepeksa netepake Gouverneur General kang awatak Senapati, miturut dhawuhe Keizer Napoleon, Kang dipilih Mr. H. Daendels. Mungguh kaanane tanah Indhiya ing nalika iku kalebu raharja. GG. Van Over Straten njaga banget marang Tanah Jawa, Betawi disentosani. Kalakon wong Inggris nempuh Betawi nganging kena dibalekake. Lakuning tetanen ing Tanah Jawa kalebu sempulur, kang akeh pametu kopi lan tebu. Sarehne isih nengah nengah jaman perang dadi wulu wetune Tanah Jawa, yaiku: kopi, gula, kapas, lsp. ora kena dikirimake menyang nagara Walanda, nanging malah kebeneran, awit dagangan Tanah Jawa banjur dikulak bangsa liya (Denemarken, Amerika) ana ing tanah Indhiya kene, dadi sing padha bathi para sudagar ing tanah Indhiya dhewe, dudu sudagar ing nagara Walanda. Tanggal 1 Januari 1808, Daendels rawuh ing Tanah Jawa. Miturut unining kakancingane Daendels mau kabawah marang Minister van Kolonien, nanging sarehne lagi nengah nengahi perang, lan Tanah Jawa tansah dinganglangi wong Inggris, dadi Daendels prasasat madeg dhewe."
88,"Sanadyan Gouverneur Generaal iku mesthine kudu nganggo rembuge Raad van Indie, nanging yen prakara perang, Daendels ora gelem taren marang Raad van Indie, kang digugu mung karepe dhewe, malah dalasan prakara paprentahan angger sing wis dikarepake iya kudu klakon. Dadi panguwasane Daendels prasasat tanpa wangenan. Saking kencenging kekarepan lan kawicaksanane, sajrone dadi Gouverneur Generaal ing dalem 3 tahun, wis akeh lelabuhane, mung kuciwane sok kurang welasan. Ing sajumenenge Daendels enggal merlokake pananggulanging mungsuh ana ing Tanah Jawa. Kehing prajurit diundhaki sarta diajari temenan. Sarehne ora bisa oleh kiriman prajurit bangsa Walanda, banjur golek wong pribumi kang gelem angkil, sakehing batur tukon kang sakira kuwat, angger gelem dadi saradadhu, banjur dimerdikakake. Daendels kenceng banget panyekele paprentahan miltair, nanging uga nyembadani panyuwune saradadhu, dadi ora kaya jaman VOC. Sarehne ora bisa oleh pitulungan saka tanah Walanda, apa kabutuhaning prajurit ing Tanah Jawa dianakake dhewe, kayata: pabrik gegaman ing Surabaya, pabrik meriyem ing Semarang, rumah sakit saprabote, sekolahan kadet (magang opsir). Kajaba iku ing Surabaya didegi beteng lan ing Betawi disentosani banget. Sarehne Parentah ing tanah Indhiya ora duwe eskader, kersane Daendels arep yasa dhewe ing sakuwasane. Ora antara lawas tanah Indhiya wis duwe prau 45, senadyan cilik nanging kukuh kukuh lan rikat lakune. Dene prau prau mau gunane kang gedhe digawe merangi bajag. Sarehne wis ana eskader, kersane Daendels arep gawe pelabuhan perang kang sentosa, kang dipilih: sunglon Meeuwenbasi (Cimajang). Bareng wis suwe panggarape lan toh pati akeh, mangka ora maju pagaweyane, banjur ngalih sunglon Merak, kang arep didadekake pelabuhan, nanging meksa ora kedadeyan, marga saka kangelaning panggarape. Dene pelabuhan kang sida dadi, yaiku pelabuhan ing Surabaya. Mungguh panggarape sakehing pelabuhan mau iya srana nindakake gugur gunung, pagaweyan tanpa bayaran."
89,"Dalan gedhe saka Anyer tekan Panarukan, kang tumekane saiki isih aran Daendels, iku perlune pancen kanggo anggampangake enggone ngukuhi Tanah Jawa, apa dene uga anggampangake bab lelakuning dagangan. Dalan gedhe mau kena kanggo tandha seksi kekencenganing karsa lan kakerasaning GG. Daendels, ing atase dalan 600 pal (+/- 1. 000 km) rampung ing dalem setahun, kang maune lakon 40 dina banjur kena dilakoni ing dalem 6,5 dina. Panggawene dalan mau uga srana nindakake gugur gunung. Sarehne dalan iku lakune urut pasisir, nrajang rawa rawa lan ana kang urut paperenging gunung, dadi panggawene rekasa banget, wong kang mati tanpa wilangan, ewa dene Tuwan Daendels ora keguh, dalan meksa dirampungake. Marga saka anane dalan Daendels, kutha kutha akeh kang dadi reja, awit gampang bisane lelawanan dagang lan papan liyane. Wulu wetuning padesan gampang panggawane menyang kutha kutha. Ing sauruting dalan iku saben let sapos didegi papan palerenan, ngiras endheg endhegan kreta post, perlu salin jaran. Dadi sanadyan dalan Daendels iku ngrekasa panggarape lan toh jiwa akeh, nanging kurup lan paedahe. Para Gouverneur Generaal sadurunge Daendels ora bisa nyirnakake tindak kaculikaning para punggawa, nanging saking kenceng lan kerase Daendels kang mangkono mau bisa sirna. Daendels ngerti yen culikane para punggawa, marga kurang cukuping blanja. Para punggawa padha diundhaki blanjane, nanging iya mung banjur mligi nampani blanja thok, ora bisa oleh bledug kaya maune. Supaya gampang enggone mriksa lebu wetuning dhuwit Daendels nganakake Algemeene Rekenkamer (kantor pangetungan lebu wetuning dhuwit). Ing sakawit para punggawa bangsa Walanda utawa bangsa Pribumi padha bisa nindakake gugur gunung, kanggo kabutuhane dhewe, nanging wiwit jamane Daendels kang mangkono mau babar pisan ora kena. Bayaran saka Parentah menyang wong cilik kang sakawit nganggo lumantar marang punggawa bangsa Pribumi; iku ndadekake banget kapitunaning wong cilik. Bareng Daendels ngerti, pranatan lantaran iku disowak, tampane dhuwit wong cilik terusan saka Gupermen."
90,"Yen ana punggawa kang meksa isih culika, abot banget ukumane, apese didhendha akeh, munggahe maneh marang dicopot, malah terkadhang bisa ukum kisis. Wiwit kawitan mula tanah tanah kang kacekel ing Walanda padha diwajibake ngladekake wulu wetu kanthi pepulih murah murahan (Contingenten stelsel). Pranatan kang kaya mangkono iku ngrekasa banget ing atase wong Pribumi, ewa dene nalika jaman Daendels isih diabotake maneh. Jembaring kebon kopi kang ditikeli lan pepulihing dhuwit minangka pituwasing penandur diudhunake. Manut pranatan lawas kopi sadhacin diregani 4,5 ringgit, manut pranataning Daendels diudhunake dadi 4 ringgit. Kajaba iku Daendels uga gawe pranatan bab panggarape alas pejaten. Murih becike koffie culture lan boschwezen banjur dianani Inspecteur Generaal. Bangsaning blandhong, oleh kemayaran uripe; kasangsarane dimayarake srana dicadhongi beras lan uyah, kejaba iku ora kena dikerigake gugur gunung, mangkono uga wong kang anggarap kebon kopi. Tumekane jaman Daendels para punggawa bangsa Europa lan Pribumi isih gedhe banget panguwasane, dadi Parentah agung ora pati Dhamang sumurupe marang ruwet rentenging negara, wasana para panggedhe akeh kang sawenang wenang tindake; ndadekake kasangsaraning kawula cilik. Akale Daendels arep nyuda panguwasaning para gedhe lan punggawa mau. Gupermen ing Tanah Jawa pasisir lor disowak, awit Gupermen iku kegedhen banget panguwasane nganti kena gawe ada dhewe, dadi pangrehing nagara iya sakarepe dhewe. Jajahan Gouverneur nuli diperang dadi 9 Landdrostambt (paresidhenan), kapanggedhene ing Landdrost (residhen). Panyekele paprentahan para residhen mau mung manut dhawuh saka Parentah luhur. Dene kang nglantarake dhawuhing Parentah marang kawula lestari para Bupati dadi rumangsane wong cilik isih kaereh ing panggedhene dhewe. Kaanane owah owahan kang kaya mangkono iku para Bupati lan para panggedhe bangsa Europa wis ora wenang netepake punggawa andhahane maneh; sanadyan punggawa cilik kang netepake iya Gouverneur Generaal. Para residhen ing Ngayogyakarta lan Surakarta ing maune kabawah Gouverneur pasisir lor, sawusing rombakan banjur macung kaparentah marang Parentah ing Betawi dhewe."
91,"Dadi wiwit ing wektu iku sakehing punggawa nglumpuk menyang Betawi kabeh dicekel ing Parentah Agung piyambak. Ada ada mau banjur diarani Centralisatie van Bestuur. Nalika jaman Compagnie ora ana pradata bangsa bumi kang prayoga manut adat lan tata carane bangsa bumi dhewe. Daendels banjur nganakake pradatan pradatan vredegericht, Landraad. Kang dadi Lid Vredegericht para pangulu lan para punggawa bangsa Pribumi, nanging mung kena ngadili prakara remeh remehan. Kajaba iku sing siji sijining Landrostambt dianani Landgericht, kang dadi lide para punggawa bangsa Pribumi, nanging dipanggedheni Landdrost akanthi Secretaris bangsa Europa. Aliya saka iku ing Semarang lan Surabaya dianani Landraad; yaiku pradatan kang wenang mutusi prakara sing gedhe gedhe, kayata: rajapati. Wong kang ora nrimakake putusaning pradata cilik cilik iya kena munggah njaluk adil marang Landraad. Pradatane bangsa Europa lan bangsa manca liyane, ing wektu iku uga dibecikake, dene kang mutusi prakarane bangsa militair (prajurit) kang perlu perlu yaiku Hooge Milataire Vierschaar ing Betawi. Nalika jamane VOC. , ora ana kamardikaning agama, kang diwenangake mardika mung agama Protestant. Sanadyan wong Katholiek kena dadi punggawane VOC. , nanging agama Kristen Katholiek ing Indhiya ora oleh kamardikan; bareng sajumenenge GG. Daendels, sakehing agama dimardikakake kabeh. Nalika jaman GG. Daendels, hawa ing Betawi ala banget, jalaran muarane kali Ciliwung waled dadi cethek, kapepetan wedhi; ing sakiwa tengening kutha banjur akeh rawane, wasana kutha Betawi kerep katrajang ing pageblug. Daendels banjur dhawuh ngurugi jagang jagang lan yasa kalen kalen kanggo ngesat kutha anjugrugi baluwarti, supaya sajroning kutha bisa oleh angin saka sagara, malah sakehing bangsa Europa padha didhawuhi ngedohi pasisir."
92,"ara Gouverneur Generaal kang wis wis racake padha ngemong semu ngempek ngempek marang para ratu bangsa Pribumi, supaya aja diewuh ewuhi enggone laku dagang, karo maneh ing sabisa bisa padha nyingkiri perang; nanging yen Daendels ora, awit pancen watak keras lan kurang duga duga ingatase karo ratu. Tindake Daendels kang mangkono iku ndadekake kurang senenge para ratu marang Kangjeng Gupermen. Ora antara lawas GG. Daendels banjur congkrah karo Sultan ing Banten, prakara enggone gawe dalan gedhe lan pelabuhan ing sunglob Meewenbaai. Sultan Banten wus mituruti pamundhute GG. Daendels, ngladekake kuli gugur gunung kehe 1. 500 nggarap pelabuhan, nanging padha mati kabeh, jalaran kajaba pegaweyane rekasa, hawane ing kono pancen ala banget. Karsane Sultan Banten wis aja njaluki maneh, nanging Daendels meksa isih njaluk bau kuli 1. 000 ing sadinane. Kangjeng Sultan ora mituruti. Kyai Patih didakwa ngojok ojoki Sri Sultan supaya mbangkanga mangeran Parentah Gupermen, mulane dijaluk menyang Betawi arep diadili GG. Daendeles. Wong Banten nepsu banget oleh dhawuh saka Daendels mengkono mau. Commandant Du Puy, yaiku utusan kang ndhawuhake timbalane Daendels menyang Banten mau dirampok ing akeh, tumeka ing pati. Bareng Daendels mireng banjur nyalirani tindak menyang Banten mbekta prajurit 1. 000."
93,"Kutha Banten digempur, kratone dijarah rayah. Kyai Patih kapikut banjur didrel. Sultan Banten dikendhang menyang Ambon. Esuke kaondhangake yen karajan Banten wis dadi darbeke Gupermen, mung kang saperangan digadhuhake marang sang Adipati Anom, diangkat sebutan Sultan. Nalika Daendels dadi Gouverneur Generaal anyar anyaran ing Cirebon mentas era eru, malah nganti dirawuhi Daendels iya durung sirep babar pisan. Saka panggalihe Daendels, ing Cirebon ora bisa tentrem yen durung dicekel ing Gupermen, wasana banjur katentokake bae yen Cirebon dadi tanah Gupermen. Jajahan Cirebon kidul, Limbangan (Sukapura, Galuh) direh ing residhent. Jajahan Cirebon lor (paresidhenan Cirebon saiki) kagadhuhake marang Sultan telu, kang kuwasane mung kaya panguwasane punggawa. Wong cilik kapasthekake enggone ngladekake wulu wetu marang Kangjeng Gupermen. Kajaba iku kono uga banjur kadhawuhake nandur kopi. Ora lawas Sultan kang sepuh katon arep mbangkang, iku banjur terus dicopot bae marang Dendels. Sarehne Compagnie nyingkiri prakara kang magepokan karo pangreh Ngayogyakarta lan Surakarta, dadi para residhent ngemong lan nglumuhi banget, yen sowan menyang kraton iya manut apa tata carane kono. Bareng jamane Daendels ana dhawuh pangkat residhent ing Surakarta lan Ngayogyakarta diganti sesebutan minister, lan ana ing kono dadi sulihing Gupermen, wis ora wajib nganggo tata krama kaya uwis uwis tumraping para ratu. Mulane Daendels dhawuh kang mangkono, awit para ratu Jawa padha ngesorake banget marang residhent, mangka pamanggihe Daendels ratu Jawa kudu ngretos yen ratu Walanda lan Gupermen iku kuwasa, pantes diajenana, sesulihe ora kena disorake (tahun 1808). Ora lawas Sultan Ngayogyakarta lan Surakarta padha derdah perkara watesing negara. Sultan Ngayogyakarta rada mempeng, nganti ngundhaki kehing wadya bala. Daendels rada sumelang yen prakara iku nganakake bebaya gedhe. Wuwuh wuwuh Sultan Ngayogyakarta kagungan karsa mundhut kalenggahane Pangeran Adipati Anom, bakal diparingake marang putra mantu. Daendels nuli menyang Ngayogyakarta mbekta prajurit sagelar sapapan."
94,"Kangjeng Sultan Hamengku Buwana II dilerehi, Sang Adipati Anom dijumenengake ratu, apangkat Pangeran Raja (prins Regent). Saka panuwune Sang Pangeran, kang rama isih lestari ana ing kedhaton, sesebutan Sultan Sepuh. Sawuse iku Daendels nganakake Commisie, kang dipatah netepake watesing karajan Ngayogyakarta lan Surakarta. Wasana sawenehing jajahan ana kang didadekake tanah Gupermen. Awit saka kaya kang kacritakake ing dhuwur iku kabeh, terang banget yen pangrehe GG. Daendels ngentekake dhuwit, mangka tanah Indhiya ora bisa oleh pitulungan saka nagara Walanda. , malah Parentah Walanda kekurangan Dhuwit dhewe. Wasana rekane GG. Daendels murih bisane oleh dhuwit, ngedol tanah Gupermen marang wong partikelir. Nganti tumekane saiki isih ana tanah partikelir kang durung ditebusi. Reka liyane maneh: a. meksa wong partikelir dikon ngutangi dhuwit, b. majegake dagangan candu, c. nganakake monopolie beras. Miturut anane pranatan monopolie iku, saanane beras kudu mbatheni. Lan maneh GG. Daendels nganakake dhuwit kertas, mangka Gupermen ora duwe tanggungan sing kanggo nebusi. Mesthi bae ajine dhuwit kertas iku ana ing pedagangan suda banget. Ewa dene Gupermen anggone ambebayari iya nganggo dhuwit kertas mau diturutake apa anane bae. GG. Daendels ora pati merlokake marang pulo pulo liyane sajabaning Tanah Jawa. Mulane ing sajrone jaman perang Napoleon, akeh jajahan kang direbut ing Inggris. Pangrehe Daendels kaya kang kacetha ing ngarep mau mesthi iya akeh paedahe, mung bae kekerasen tindake marang punggawa, wasana ing tahun 1811 Daendels bali menyang negara Walanda digenteni Janssens. Janssens mau satemene mung kepeksa enggone gelem dadi Gouverneur Generaal, jalaran tanah Indhiya kekurangan dhuwit lan para ratu bangsa Pribumi isih padha muring marang Gupermen, marga saka tindake Daendels. Ora antara suwe Betawi ketekan mungsuh wong Inggris; kang nyenapateni Lord Minto Gouverneur Generaal ing Indhu. Wong Walanda karoban lawan, Janssens keplayu menyang Semarang."
95,"Para ratu Jawa dijaluki bantu, nanging prajurit saka kejawan ora kena diendelake ing gawe, malah Sultan Ngayogyakarta mbalik ngiloni Inggris. Wasana ing Tuntang kepeksa nungkul kanthi prajangjian tahun 1811. 1. Satanah Jawa dadi duweke wong Inggris, 2. Sakabehing prajurit dianggep tawanan, 3. Wong Inggris ora gelem ngakoni utange Parentah ing Betawi, ing sajroning tanah Walanda dadi golonganing Frankrijk. 4. Sakehing punggawa kang gelem ngenger marang OIC. Inggris, dilestarekake ing kalungguhane. Sarampunge prajangjian Tanah Jawa dadi jajahane Oost Indische Compagnie Inggris."
96,"1787 - 1820 Paku Buwana IV. (Sinuwun Bagus) 1812 - 1814 Hamengku Buwana III 1814 - 1822 Hamengku Buwana IV. (Sunan Jarot) 1814 - 1820 Diembani Paku Alam I 1813 Paku Alam I (Pangeran Nata Kusuma) anah Indhiya miturut dhawuhe Lord Minto, diperang dadi 4 Gupermenan, yaiku Malaka, Sumatra pasisir kulon, Moloko, Tanah Jawa lan wewengkone. Gouvernement Tanah Jawa lan wewengkone kang ngerehake Litenant Gouverneur (wakile Gouverneur Generaal) Thomas Stamford Raffles, kabantu ing Adviseerende Raad, lide ana telu yaiku: Gillespie, wong Inggris, Cranssen lan Muntinghe, wong Walanda. Raffles ngrembug banget marang prakara ing karajan karajan Jawa, nemtokake wewenang Parentah Inggris tumrap karajan karajan mau. Nalika Tanah Jawa kabawah Inggris, ing Banten isi dahuru bae, jalaran Sultan sing ditetepake Daendels ora disujudi ing kawulane. Ing tahun 1813 Sultan Banten dirukun karo Raffles, kablanja 10. 000 ringgit setahun, nanging jajahan Banten dijaluk. Mengkono uga Sultan Cirebon tetepane Daendels iya mung diblanja tahunan, tanahe dadi duweking Gupermen Inggris. Nalika kang nyekel Tanah Jawa ganti Parentah Inggris, Ngayogyakarta wis salin kang jumeneng Sultan Hamengku Buwana II (Sultan Sepuh), kang dilerehi Daendels, ngesur keprabone Sultan Raja. Sultan Sepuh mau ing sakawit ngrewangi wong Inggris anggone ngluangake wong Walanda, nanging olehe tetulung mau mung kanggo sarana ngarah."
