,text_jw
67,"Nalika prajurit Walanda teka ing kutha, wong Jawa lan wong Bali wis perang dhewekan. Sasuwene ing paperangan geger gegeran, Mayoor Tak di kroyok ing gegaman, prajurit 70 kang mati. Untung Surapati sakancane bablas mlayu mangetan. Ana ing Pasuruwan Untung Surapati ngedegake karajan. Untung Surapati jumeneng adipati jejuluk Wiranagara jajahane saya jembar, nenelukake ing sakiwa tengene malah nganti tekan ing Kedhiri, Sarehne Untung Surapati saya ndadra, Mangkurat II minta sraya marang VOC. nanging GG. van Outhoorn durung mituruti. Nalika semana ing saTanah Jawa akeh sekaitan nglawan wong Walanda. Sawenehing panggonan disebari layang nyalawadi kang ngemu rasa ngojok ojoki numpes wong ""kapir"". Akeh priyagung Banten lan Mataram sing padha mbiyantu sekaitan iku. Malah ana wong Melayu saka Sumatra aran Ibnu Iskandar kang melu dadi penuntune sekaitan mau, nglurugi Betawi nggawa prau akeh. Bareng konangan ing Walanda banjur ditempuh rusak bebarisaning prau. Prakara iku njalari enggone VOC. ora gelem ngrewangi Mangkurat II. Ing tahun 1703 Mangkurat II seda, kang gumanti jumeneng, Sunan Mas utawa Mangkurat III; marga saka cacading sampeyan, uga katelah asma Sunan Kencet. Sunan Mas congkrah lan pamane Pangeran Puger, mungguh kang dadi jalarane iya saka siyane Kangjeng Sunan. Sunan Mas iku pancen misuwur siya lan sawenang wenang tindake. Pangeran Puger lolos saka Kartasura, tindak menyang Semarang mundhut pitulungan Compagnie. Sunan Mas wis rambah rambah kirim layang menyang Betawi, mundhut balining pamane, nanging ora direwes, awit parentah ngerti yen Sunan Mas sekutu lan Untung Surapati nedya nglawan Compagnie. Parentah Betawi uga ora gelem nganggep Sunan marang Mangkurat III; kang dianggep malah Pangeran Puger, awit Sang Pangeran ana ing Semarang uga wis kaangkat Sunan dening para priyagung akeh, jejuluk Sunan Paku Buwana. Anane perang rebut kaprabon iku wiwit ing tahun 1704, tekan tahun 1708. Marga saka pitulungane VOC. Paku Buwana bisa lestari jumeneng ratu, nanging miturut perjanjian ing tahun 1705 jajahane VOC."
68,"dielar mangetan, watese sisih lor Cilosari, ing sisih kidul Cidhonan ing Cilacap. Sunan Mataram wis ora duweni wewenang ing atase tanah Sumenep lan Pamekasan. VOC. diwenangke kena sediya prajurit ing Kartasura maneh. Nalika Kartasura ditekani wadyabala Walanda, Sunan Mas lolos mangetan mundhut pitulungan marang Untung Surapati. Ing tahun 1706 prajurit VOC. kang disenapateni Knol nempuh ing Bangil, yaiku betenge Untung Surapati kang santosa dhewe. Ing Bangil bedhah, nanging Untung Surapati ora kecekel, mung bae amarga ketaton ora antara lawas mati. Ing tahun 1707 ana prajurit VOC. nglurug mangetan maneh merangi para anake Untung Surapai kang mbiyantu Sunan Mas. Ing tahun 1708 Sunan Mas asrah bongkokan marang Knol, nuli kakendhang menyang Ceylon. Ing tahun 1719 Paku Buwana I seda, njalari perang rebut kaprabon kang kapindho. Para sadhereke Sunan anyar Prabu Mangkurat IV padha merekake nganti nganakake perang. VOC. mitulungi marang Mangkurat IV. Para panganjure kraman padha dibuwang menyang Ceylon utawa menyang jajahan Compagnie ing Afrika sisih kidul (Kaapkolonie)."
69,"alika J. Maetsuycker madeg dadi Gouverneur Generaal (tahun 1653 - 1678) jajahan darbeke Compagnie wis rada akeh. Betawi lan wewengkone, wiwit tahun 1619 Kutha Malaka lan wewengkone, tahun 1641 Ambon, Kepulowan Bandha, Makasar, tahun 1667 Punto de Gale lan Legombo ing Ceylon, tahun 1658 Tlatah tlatahane pasisir Coro9mandel, lan Malabar, tahun 1661 Kejaba iku VOC. iya duwe kantor ing pasisire sunglon Persi, ing Benggala, Siyem, Formosa lan Decima. Saking jembaring jajahan lan kehing kauntungan VOC. bisa sugih lan kuwasa. Para aandeelhouder wis akeh banget bathine, ngungkuli bathen kang wis katemtokake, iya iku 12,5%. Ing tahun 1642 bageyaning Bathi nganti mundhak tekan 50%, VOC. dadi ndedel, ing saantarane tahun 1630 lan tahun 1650 bisa tikel 3 utawa 4. Kauntungane VOC. iku jalaran saka pranatan monopolie. Marga saka monopolie mau VOC. bisa kulak murah lan yen dodolan dilarang larangake. Upama bumbu craken: pangulake pala sa""pun"" terkadhang mung 7,5 sen, pangedole 3,5 rupiyah. Pangulake cengkeh sa ""pun"" 20 sen, pangedole sok 10 rupiyah. Pangrehing VOC. (Bewindhebber) ing tanah Walanda kang diarah mung ngencengake pranatan monopolie, ora susah njembarake jajahan. VOC. kudu ngedegake loji loji maneh, awit VOC. kudu mung salugu dedagangan."
70,"Balik pangrehing VOC. ing Betawi karepe ngendhokake monopolie. Wong bumi kerep disuwunake idin GG. Coen lan van Diemen prakara kamardikaning dedagangan, nanging para Bewindhebber ora mituruti. Punggawane VOC. akeh kang wong asor lan ala, wuwuh wuwuh blanjane ana ing tanah Indhiya mung sathithik. Blanja kawitan (asisten = carik) mung 10 rupiyah, banjur mundhak 55 rupiyah (koopman) lan 75 rupiyah (opperkoopman) ing sasasine. Blanja sathithik mau tampane nganggo dicowok umpamane kanggo tetanggungan. Kang mangkono iku njalari para penggawa padha dagang peteng utawa dagang colongan. Ananging sarehne dagangan VOC. nalika semana gedhe banget lan bathine dudu sebaene dai prakara klerune pranatan monopolie apa dene tindake para punggawa sing ora bener isih samun durung pati ketara. Ing kawitane abad kang ping 18 jajahane VOC. akeh banget, apa maneh ana ing Tanah Jawa. Jajahan lan panguwasane karajan Banten lan Mataram saya kalong kalong. Betawi, Krawang tekan kali Indramayu, Priyangan tekan segara kidul; Semarang lan wewengkone (tahun 1677), Cirebon wus ngaub marang VOC. Tapel watese jajahan Banten sisih wetan Cisedane. Jajahan VOC. mangetan tekan Cilosari lan Cidhonan (tahun 1705). Ing tahun 1659 VOC. prajangjian karo Sultan ing Palembang, oleh idin ngedegake beteng ing bawahe. Ing tahun 1667 VOC. ngedegake loji ana ing Padhang. Sawise prajurit Walanda mitulungi marang para kawulane ratu Aceh, kang jajahane dhek maune ketug ing Indrapura (Sultan Iskandar Muda), VOC. ora mung katon gedhe panguwasane nanging iya katon sugih. Kutha Betawi saya suwe saya gedhe lan asri, nganti diarani ""Ratuning kutha ing bumi sisih wetan"". Dadi ing jaman iku VOC. kaya kaya lagi mumbul mumbule. Mungguh ing satemene senadyan gelare kuwasa lan sugih banget, VOC. wis mundur, ngalamat arep bobrok. Kasugihane saya kalong, malah terkadhang terkadhang uga nganti tuna, nanging kejaba para Bewindhebber ora ana kang ngerti, awit digawe wadi banget."
71,"Para Bewindhebber enggone aweh dividend (anakaning andhil) marang para aandeelhouder isih ajeg akeh. Dadi saya suwe bandhane VOC. saya suda. Mungguh karepe para Bewindhebber enggone ngrendhem wadi mau, supaya VOC. diaranana isih sugih lestaria diandel aja nganti kepaten ubed. Wasana ing tengahing abad 18, VOC. wis katandhegan utang 3 yuta. Kang dadi jalaran sudane kasugihan VOC. warna warna, kayata: 1. Kehing wragad VOC. kanggo peperangn, tansah kapeksa sediya prajurit lan prau perang akeh. 2. Rehne jajahan saya jembar, punggawa saya mundhak akeh, anjalari undhaking wragad. 3. Kauntungan laku dagang wis ora kaya wis ora kaya dhek abad kang kepungkur, awit akeh punggawa VOC. lan wong bumi padha laku dagang peteng utawa dagang colongan, VOC. enggone mblanjani punggawane kesethithiken, dadi punggawane mau kepeksa golek kauntungan liya sarana dagang peteng. Dene wong bumi enggone dagang colongan lelawanan wong Inggris utawa bangsa manca liyane. Marga saka malaking VOC. enggone nindakake monopolie, wong bumi padha gelem nerak prajangjiane monopolie. Rehne wong bumi wis dadi mlarat marga saka pamering VOC. Lan punggawane karajan Jawa, barang pedagangan saka Europa mung sathithik payune. 4. VOC. enggone dedagangan ana ing Europa kerep tuna banget, marga dijori ing bangsa Inggris lan Prasman. Rekane para Bewindhebber enggone arep nututi kapitunane serana ngencengake tindaking monopolie lan nglarangi dagang peteng. Ewa dene sanadyan dagang peteng iku dilarangi banget kanthi ukuman abot, meksa saya ndadra, awit VOC. ora ngundhaki blanjane punggawane, lan pangulake barang dedagangan kemurahen. Ana reka dayane VOC. kang sakawit ndadekake kauntunganing VOC, dhewe lan bangsa bumi, yaiku enggone nganakake wulu wetu liya, kayata: nila, lawe, secang (kanggo pulas). Kang akeh banget pametune yaiku kopi. GG. Zwaardekroon ngudi banget marang ajuning tanduran kopi mau (tahun 1718 - 1725). Wiwit VOC. dagang kopi iku maune saka rembuge P. van den Broecke, nalika isih ana ing Mokka (jajahan Arab)."
72,"Saya suwe kopi mau ana ing Europa saya payu. VOC. enggone kirim kopi weton Mokka menyang Amsterdam ing sataun taune nganti 300. 000 pun. Bareng wong Turki ngengel engel wetuning dagangan kopi, VOC. nuli nyoba nandur dhewe ana ing Tanah Jawa (tahun 1706). GG. Zwaardekroon prajangjian lan wong bumi dikon nandur kopi, pametone saben sadhacin bakal dituku 15 ringgit. Wong bumi seneng atine dene pituwase memper, mulane iya saya maju panggarape, Tanah Jawa saya akeh pametune. Nanging suwening suwe VOC. saya sawenang wenang, regane kopi didhunake nganti 1 dhacin mung diajeni 5 ringgit. Wong bumi banjur suda kamajuwane, wit kopi akeh kang ditegori. Ing tahun 1721 Parentah ing Betawi meh bae kabilaen, marga saka panggawene Pieter Elberfeld, iya iku sawijining Walanda pranakan Jerman lan Jawa. Pieter Elberfeld mau duwe sedya arep ngraman jalaran nalika patine bapakne saperanganing warisane dadi meliking Parentah. Pieter Elberfeld banjur ngirup bala dibantu wong Jawa, aran Kartadriya andhel andhele Untung Surapati. Ana bangsa mutihan kang ngojok ngojoki wong sarana andum jimat. Karepe Pieter Elberfeld sakehing Walanda bakal ditumpes, dinane ditemtokake tanggal 1 Januari 1722. Bareng ndungkap tumekaning wektune, Parentah Betawi lagi bae oleh warta. Pieter Elberfeld sakancane enggal ditukup; sawuse ngaku banjur dipateni siya siya. Endhase Pieter Elberfeld dikethok, ditanjir ana ing regole pekarangane dhewe, omahe dirombak, pomahane disangarake ora kena dienggoni ing wong. Dhawuhe Parentah katulis ing watu, tumekane saiki isih tetep mengkono."
73,"Mas Garendi (wayahe Mangkurat III) utawa Sunan Kuning, Mangkurat V. Mangkubumi, Pangeran Mas Said 1727 - 1749 Paku Buwana II 1725 - 1729 M. de Haan 1755 Hamengku Buwana I 1749 - 1788 Paku Buwana III. 1637 - 1639 A. Valckenier 1757 Mangku Nagara 1743 -1750 G. van Imhoff 1750 - 1761 J. Mossel ng wiwitane abad kang kaping 18 Betawi akeh banget Cinane. Ora antara suwe wong Cina mau akeh sing angguran; ing kutha Betawi lan wewengkone kerep ana rerusuh. Ing saadege Betawi akeh wong Cina kang diboyongi saka Banten menyang Betawi kanggo ngrejakake kutha, awit wong Cina mau sregep lan pinter gegaweyan. Sesanggane dientengake, supaya Cina liyane padha kepengin gelem manggon ing kono. Wasana ing wiwitane abad 18 duga duga ing sajroning kutha bae ana jiwa Cina 60. 000 lan ing wewengkon Betawi 40. 000."
74,"Dene kang dadi pangupa jiwane, nenukang, adol gula, teh, nganti akeh kang bisa dadi sugih. Ewa dene suwe suwe ing Betawi saya akeh Cina kang ora duwe panggaotan, gawene mung ngemis, malah ora sethithik kang gelem nindakake kadurjanan. Kang ndadekake ora trimane wong Cina iya iku: 1. Dhawuhe GG. van Swol (tahun 1713 - 1718) bab reganing teh Cina. Tekane Cina saka ing negarane padha numpang prau kang momot teh didol marang VOC. Bareng para Bewindhebber rumangsa ora pati akeh kauntungane enggone dagang teh, GG. mau banjur namtokake yen teh weton negara Cina, kang maune diajeni 60 rupiyah ing sadhacine, ing sabanjure bakal diregani 40 rupiyah. Temahan nuli ora ana prau momot teh teka ing Betawi. Saka pangudining GG. Zwaardekroon wiwit ing tahun 1722 ana prau momot teh maneh teka ing Betawi. 2. Ing tahun 1706 wis ana angger nglarangi wong Cina teka ing Betawi tanpa panggaotan. Wiwit tahun 1722 Parentah dhawuh nggawa Cina kang tanpa panggaotan, menyang Ceylon, Bandha utawa Kaap de Goede Hoop. Mung kang duwe layang pratandha idining Prentah, kena lestari manggon ing Tanah Jawa. Ewa dene ing Betawi ing Betawi ora entek entek Cinane kang angguran sarta gawe rerusuh. Wusana ing tahun 1740 GG. Valckenier nemtokake putusan: sakehing Cina kang sakira nyumelangi, senadyan duwe layang pratandha, kudu dicekel kalebokake ing kunjaran, perlu katiti priksa. Cina mau yen ora duwe panggaotan kudu digawa menyang Ceylon, diwenehi pagaweyan nggarap kebon manis jangan. Para punggawa kang nindakake dhawuh mau, padha golek kasil, senadyan Cina sugih padha diancam arep dikirimake menyang Ceylon, supaya metu besele. Wekasan dikabarake yen kareping Parentah nedya numpes Cina kabeh. Cina padha muring kamoran wedi, akeh kang lunga saka kutha, klambrangan gawe rerusuh malah nganti wani nempuh kutha."
75,"Wong Walanda saya giris bareng krungu warta yen kraman sajabaning kutha sekaitan karo kang ana ing jeron kutha, pratandhane dene padha tandho gegaman lan nyingkirake anak bojone; besuk yen ana omah kobong Cina jaban kutha lan jeron kutha bakal bebarengan nempuh. Dumadakan sawijining dina ana omah kobong temenan. Bangsaning Walanda arahan dibantu para matrus sarta saradadu apa dene wong Jawa lan batur tukon banjur padha tumandang ngiras males ukum marang pangrusake Cina. Genining omah kang kobong diubal ubal, sakehing Cina kang ora bisa oncat padha dipateni, barang darbeke dijarah rayah. Nganti saminggu suwene mung mangkono bae kaanane. Omah kang kobong ana 600, Cina kang dipateni kira kira 10. 000. Nguninani pangrusak kang nggegirisi iku, Prentah ing Betawi kendel bae. Para prajurit melu gawe rusuh ora dilarangi. Malah nalika lagi ana era eru iku GG. Valckenier dhawuh mateni sakehing Cina kang ana ing pakunjaran. Ing satentreming kutha Parentah ngondhangake pangapura marang Cina, kang gelem masrahake gegaman. Akeh kang gelem manut, nuli diwenehi panggonan ing jaban kutha dadi sakampung. Cina kang padha oncat saka Betawi lan Cina ing liya panggonan, ngumpul dadi baris gedhe, ngepung kutha Semarang. Sunan Paku Buwana II mbiyantu marang Cina, awit digalih Cina bakal bisa nglungake Walanda, lan banjur dhawuh nempuh beteng Walanda ing Kartasura. Para opsir ana ing kono padha dipateni, saradadhune dipeksa manjing Islam. Ing sawuse wong Walanda ing Semarang oleh bantu saka Betawi, wong Cina keplayu. Wong Madura uga mbiyantu marang VOC. Dhek samana Sunan Mataram sumelang yen bakal tampa piwalese VOC. mulane enggal enggone minta pangaksama. Para priyagung Jawa kang sengit marang Walanda lestari mbiyantu Cina, dadi mungsuh ratune dhewe. Kartasura ditempuh, Paku Buwana II kengser. Banjur Mas Garendi, wayahe Sunan Mas kajumenengake ratu, ajejuluk Mangkurat V, nanging katekane sinebut Sunan Kuning. Parentah Betawi nuli nglakokake bala menyang Kartasura."
76,"Kabeneran kraman Jawa ecrah lan kraman Cina, dadi gampang enggone nungkulake. Mas Garendi dibuwang. Kratone Paku Buwana II banjur dielih menyang desa Sala, kang nuli dijenengake Surakarta Adiningrat. Pulo Madura lan Tanah Jawa pasisir lor banjur dipasrahake marang VOC. Surasane prajangjian ing tahun 1743 mangkene: Sunan Paku Buwana ngakeni yen enggone lestari ngrenggani kaprabon iku mung saka kawelasane VOC. Bareng Cakraningrat ing Madura tampa dhawuh yen negarane dipasrahake marang VOC. , banget ing pambangkange, malah ngejegi tanah Madura sisih kulon, lan tlatah tlatah ing Tanah Jawa Wetan. Temahan diperangi ing VOC. Ora lawas Cakraningrat kecekel, dibuwang menyang Kaap de Goede Hoop. Putrane diangkat bupati dening VOC. ngereh Madura kang kulon. Tanah wewengkoning Betawi nalika ana kraman banget karusakan. Dhek samana kang jumeneng Gouverneur Generaal Baron Van Imhogg (tahun 1743 - 1750) iya iku priyagung kang sregep lan cakep ing gawe. Saka pangudine Van Imhoff tanahe bisa reja maneh. Nalika tahun 1744 Van Imhoff pepriksa menyang wewengkoning Betawi nganti ketug pagunungan. Sawusing papriksa, kersane GG. Van Imhoff, tanah tanah kang bera arep disewakake utawa digadhekake, kareben metu kasile. Wong kang nggadhe utawa nyewa tanah bakal oleh wewenang sarta pangayoman saka Parentah, nanging wulu wetune kudu didol marang VOC. , regane ditemtokake ing Parentah. Van Imhoff dhewe nuladhani, mbobak tanah ing sukune gunung Salak, sarta ing kono ngedhegake pasanggrahan dijenengi Buitenzorg (tahun 1744). Para Bewindhebber nuli aweh lulusan yen Buitenzorg katetepake dadi pasanggrahane para Gouverneur Generaal. Kajaba saka iku Van Imhoff nekakake wong saka nagara Walanda kang pancen baku tani. Banjur pranatan kang ndadekake kapitunane wong Jawa disuwak, yaiku yen pametune kebon kopi kakeyan, kebon mau dibabadi amrih undhaking regane kopi. Tindak mangkono iku dilarangi, nuli GG. Van Imhoff nemtokake keh sathithiking kopi kang dadi laden marang VOC."
77,"Van Imhoff sawise njajah Tanah Jawa Tengah sarta Wetan, nuli ngarang layang palapuran kang maedahi banget ingatase Parentah. Ing ngisor iki kacarita bab perang lan reribede VOC. sarta Mataram kang marga saka kurang wewekane tindake Van Imhoff. Nalika GG. Van Imhoff ana ing Surakarta ing wektu samono Pangeran Mangkubumi lagi seserikan karo kang raka Kangjeng Sunan. Saka kersane Van Imhoff arep ngelingake marang Sang Pangeran nganti kewetu serenge ana ing pasamuan, andadekake banget serike Pangeran Mangkubumi, awit rumangsa bener, kok malah disrengeni. Ing saundure saka pasamuan Sang Pangeran trus lolos saka nagara, ngimpun bala sarta banjur gandheng karo Raden Mas Said, kang ing wektu iku wis madeg kraman uga. Priyagung sakarone wis sekutu ngraman marang Sunan Paku Buwana II. Ing tahun 1749 kraman durung kena disirep, banjur Kangjeng Sunan seda, iku saya andadekake kisruhing nagara. Nalika Paku Buwana II isih gerah, Van Hogendorp, Gouverneur ing pasisir lor, ditimbali, dingendikani bab oreging nagara. Dadining rembug karajan Surakarta dipasrahake babar pisan marang VOC. Dadi ing satemene wiwit tahun 1749 para ratu Jawa wis ora kagungan bumi. Sanadyan saka karsane kang rama Pangeran Adipati Anom wis ora duwe wenang marang karajan Surakarta, nanging Sang Pangeran meksa kajumenengake nata dening Van Hogendorp, mung bae enggone jumeneng mengku nagara dumunung anggadhuh. Para priyagung ing Surakarta akeh kang mrekitik atine bareng ngerti yen tanah Surakarta dadi darbeking VOC. , banjur padha mbalik ngiloni Pangeran Mangkubumi. Sadurunge Pangeran Adipati Anom jumeneng Paku Buwana III, Mangkubumi wis ngaku jumeneng ratu ing Banaran. Sarehne Pangeran Mangkubumi kumpul lan RM. Said, dadi santosa banget, nganti bisa ngelun luwih saparone Mataram. Paku Buwana III ora kagungan wragad sarta prajurit ora bisa lumawan perang, dadi anane mung mangsa bodhoa marang VOC. Perange kraman lan Compagnie genti unggul genti kasoran, wusana ing tahun 1751 Pangeran Mangkubumi bisa ngalahake Compagnie ing sacedhake kali Bagawanta."
78,"De Clerq senapatining prajurit, mati. Sabakdane iku Sang Pangeran ngalakokake bala mengalor nelukake Pekalongan malah meh nglojok jajahan Compagnie. Parentah ing Betawi sumelang banget, nuli nyantosani prajurit, wasana Mangkubumi kepeksa mundur, mubet ing wewengkone Mataram maneh. Ora antara lawas Pangeran Mangkubumi ecrah lan RM. Said nganti padha peperangan dhewekan, awit RM Said duwe pamelik arep jumeneng Sunan dhewe. Prakara iku ndadekake kamayarane VOC. ewa dene Parentah iya meksa rada wegah; utawa maneh sarehne ngeman rusaking nagara lan wong cilik, mulane GG. Mossel rujuk lan karepe Van Hogendorp, para panggedhening kraman arep dirukun bae, dicuwilake tanah Mataram. Ing tahun 1754 GG. Mossel tindak menyang Semarang katemu lan Kangjeng Sunan, perlu rembugan enggone arep merang karajan Mataram. Paku Buwana manut bae, awit ora ana kang diendelake. Kelakon Van Hogendorp bisa rembugan lan priyagung sakarone ing kraman, nanging ora kedadeyan. Kang gumanti Governeur Harting iku bisa angon mangsa. Sarehne Mangkubumi lan RM. Said tansah memungsuhan, mangka RM. Said kegedhen panjaluk, mulane tumrape Harting gampang bae enggone bedhami karo Mangkubumi. Ing tahun 1755 Sang Pangeran Mangkubumi bedhami lan Compagnie sarta Kangjeng Sunan ing Giyanti. Putusing bedhami Sang Pangeran kajumenengake ratu ngereh saparoning karajan Mataram, nanging kudu netepi prajangjian kuwajibane marang Compagnie. Sang Pangeran Mangkubumi banjur jumeneng ratu akadaton ing Ngayogyakarta Adiningrat jejuluk Sultan Hamengku Buwana I, Senapati Ing Ngalaga Abdulrahman Sayidin Panatagama Kalipattulah. Wiyosane malem Rebo Pon kaping 27 Ruwah windu Sengara tahun 1641 sinangkalan ""Janma Karya Wayanging Rat"" utawa kaping lima malem 6 Agustus 1717. Mungguh luhuring panggalihane Sang Prabu dicritakake ing layang Rajaputra, mengkene : "" Brataning galih sang nata, tansah olah jayeng jurit, atiti prana niskara, sura mbeg putus mikatsih, muja suraning dasih, pinrih samya gregetipun, sura asmareng laga, memthek kang wus wiradi, sinakyun dinadar boga busana."
79,"Sinuksma gung bala tantra, panglembanira ngenting, kongas ing prabawa nata, murba prabaning memanis, mawenes ing prajasri, asri rasning rum arum, sumiram warteng wadya, warata esthining dasih, srah susetya rena lir manggih suwarga. Warga gung gambira samya, sumyak tejaning nayadi, adining kawirotaman, tumameng karya narpati, ketang sihnya Sang aji, lumrah kang bala wadyagung, galaking para muka, tanah ing liyan nagari, myang ing manca kekes samya mestu deya"". Ing layang Rajaputra kono uga nyebutake kresanane Sang Prabu: dahar sega pulen wangi, jangan loncom tanpa santen, bubuk dhele lan tempe gedhe ginoreng. Kang minangka dhaharan (panganan): ketan enten enten, lemper iwak pitik, ketan kolak gedhang raja. Dadi mung sarwa gampang, tur murah lan mirasa. Tanah wewengkone praja Kasultanan dhek semana ora dadi siji kaya saiki, jalaran lemah lenggahe ing Surakarta lan Ngayogyakarta padha pating plencat lan ora silah. Wewengkoning karajan karo karone kena kabedakake dadi telung warna: 1. Negara yaiku kutha karajan; 2. Negara Gung, tanah sakiwa tengene negara, lan 3. Manca negara. Kanggo lumrah lemah lungguhe para punggawa iku ana ing negara gung, ana siji loro kang ana ing manca negara. Tanah manca negara mau dipenggedheni bupati kang banjur kena sanggan pajeg pabandaran (strandgelden), tanah Kejawan mung kari : Kutha Surakarta lan Ngayogyakarta Negara gung iya iku: a. Mataram = Ngayogyakarta, b. Pajang = Surakarta sisih kidul kulon, c. Sukawati = Surakarta sisih lor wetan, d. Bagelen, e. Kedhu, f. Bumi Gedhe = Surakarta sisih lor kulon, lan III. Manca Negara, yaiku Banyumas, Mediyun, Kedhiri, Japan = Surabaya sisih kidul kulon, Jipang = Rembang sisih kidul wetan, Grobogan lan tanah cilik cilik liya sawatara. Murih dhamange ing buku Klepu, panggawene ana ing desa Klepu dhek tanggal 26 September 1757. nanging buku iku ilang, mulane banjur ndadak gawe maneh ana ing Semarang ( 2 Nopember 1773). Kamot ing layang kang dijenengake ""Semarangsche Legger""."
80,"Sajroning paprentahane Sultan Swarga, Ngayogyakarta dadi karta raharja, nganti karusakane nalika paprangan wis pulih ora ana labete. Tumekaning seda, Sinuwun Hamengku Buwana I lestari becik karo Kompeni. Bangsa Jawa ngluhurake banget karo panjenengane lan ngalem marang kasetyan lan kasudirane, nanging marga sugenge iku kerep ngrekaos, banjur rada nemahi watek brangasan sethithik. Kerep banget pradondi prakara wates karo karaton Surakarta. Dene lereme marga ananing wates anyar ing tahun 1773. Tangkebe karo Pangeran Mangkunegara, yaiku putrane mantu, rada kurang becik. Luwih luwih wiwit tahun 1763 saploke Kangjeng Sultan mindhokake putrane (Kangjeng Ratu Bendara) karo Kangjeng Pangeran, banjur kerep banget padha ejeg ingejegan rebutan bawah nganti angel pisah pisahane, marga prakara enggone padha pasrahan punggawa kang padha aliyan bendara, banjur padha perang maneh. Kejaba iku Pangeran Mangku Negara ora saged ngapura marang Sultan Hamengku Buwana I, marga garwane dipundhut bali mau. Dene Kangjeng Sultan ndakwa, yen Pangeran Mangku Negara gawe rusuh ana ing bawah Kasultanan. Kangjeng Susuhunan ing Surakarta ngeloni Pangeran Mangku Negara. Perange iku nganti tekan tahun 1777. Wiwit tahun iku tangkepe Sultan Swarga marang Kangjeng Sunan lan Pangeran Mangku Negara katon becik. Kacarita RM. Said isih mbajurake perange, nanging suwe suwe ora bisa lawan, awit dibut prajurit VOC. lan balane Sultan Hamengku Buwana. Bareng kapepet ing tahun 1757 gelem bedhami ana ing Salatiga; putusane RM. Said kacuwilake karajan Surakarta, kajumenengake Pangeran Adipati, jejuluk Mangku Negara, ngereh tanah Keduwang lan Wanagiri, nanging iya nganggo prajangji mbangun miturut VOC. Nalika VOC. lagi nengah nengahi perang lan kraman Surakarta, yaiku tahun 1750, ing Banten ana kraman uga; mungguh kang dadi jalarane mangkene: Wiwit ing tahun 1733 kang jumeneng ing Banten Zeinul Arifin. Iku pangalihane ora kukuh, nganti kena kena diepak ing garwane trah Arab, asma Sarifah Fatimah."
